Answer,Question,
1," Analytic Languages have very little or no morphology and rely on word order to express grammar. English, Chinese, and Vietnamese are examples of analytic languages.",
1, Articulatory phonetics is an area of phonetics that deals with how our vocal tract produces the sounds of language.,
1, Assimilation is a phonological process in which one sound becomes more similar to a neighboring sound.,
0," Auxiliary verbs, modals and main verbs all occur in V under VP",
0, Borrowing is a morphological process in which a language makes new words by combining several words from other languages.,
0," Derivational morphemes in English are small in number, regular, very productive and don't change parts of speech, have only grammatical functions, and are all suffixes.",
1, Diphthong is a vowel in which a stop is followed by a fricative in rapid succession,
1," Do not single (or double) space the entire program, use blank lines when appropriate",
1, Each computer has its own machine language which is made of streams of 0's and 1's,
1, Fricative is a consonant sound made by creating a bottleneck of airflow when our tongue approaches but doesn't touch a place of articulation.,
1, Insertion is the phonological process in which a sound may be added to the middle of a word,
1, Lexical ambiguity can be defined as a word/phrase that has more than one meaning.,
1, Linguistics is the scientific study of languages,
1, Main memory is a place where the programs and data are store temporarily during processing,
0, Morphology studies rules of sentence and phrase formation and their hierarchy in relation to each other.,
1, One benefit to the use of symbolic languages is improved programming efficiency compared to a machine language,
1, Phonetics and Phonology deal with sound. Morphology and Syntax deal with structure. Semantics and Pragmatics deal with meaning.,
0, Phonology is a study of speech sounds in isolation,
1," Physical capabilities, input, and innate predisposition for language are required for a child to learn their native language.",
1, place a single space between all operators and operands,
1, Pseudo-code and flowcharts can be used to represent individual algorithms of a program,
0, Pseudo-code uses exact programming language syntax to represent a module in the larger program----pseudocode are english like statements that follow loose syntax and convey design,
0," Psycholinguistics is a study of mechanisms of the brain that underlie how we acquire, produce, and understand language.",
1," Secondary storage, similar to main memory, also stores programs and data",
1, Select meaningful identifiers (names) for all the variables in the program,
1, Software engineering is the use of sound engineering methods and principles to obtain software that is reliable,
0, Suffixes -er in baker and -en in oxen are inflectional morphemes.,
1, Symbolic languages use mnemonics to represent the various machine language instructions,
1, The C programming language is considered a structured programming language,
0, The C programming language is not considered a high lelvel programming language because of its age-----C programming is a high level language,
1, The preprocessor prepares the code for translation into machine language,
1, the process of converting a high-level language to machine language is known as compilations,
1," The three constructs of structured programming are: 1.) sequence, 2.) selection, 3.) looping",
1, The waterfall model of developing software places an emphasis on planning and testing,
0, There is no need to include example output in your submission,
0, Voiced sound is a speech sound created when vocal chords are apart and air is slowing freely through.,
0, Writing code is the first step in the waterfall model of developing software---planning,
1,". According to Pascal, deciding whether or not to believe in God is not an optional decision.",
1,". According to psychological egoism, unselfish behavior is impossible",
1,". According to your text, you can act in your own self-interest without being selfish.",
1,". In your reading from Plato's Phaedo, Socrates argues that our souls must have existed before our birth.",
1,(Na+-K+) ATPase is located in the plasma membrane and has both alpha and betha subunits,
1,(Na+-K+) ATPase is stimulated by K+ and Na+,
0,(Na+-K+) ATPase requires intracellular ATP,
1,(Na+-K+) pumping activity causes a net outword current of positive charge across the plasma membrane and tends to generate a negative intracellular electric potential,
0,"10 year forward averaging of taxes due, is available for all participants of a defined contribution plan",
1,10% of the Japanese see Christianity as a viable religious alternative for themselves.,
1,12 g of carbon would basically have the same number of atoms as 4 g of helium,
1,20% of Mali's children die before their fifth birthday.,
0,"3, 5, 7, 9, 11...is a quadratic pattern",
1,30-40% of new teachers leave the classroom within five years.,
0,300-nm light has a lower frequency than 500-nm light,
1,4% of the worlds trade passes through the Panama Canal.,
1,401k Plans require immediate vesting on employee contributions,
1,70% of Japanese claim no personal religion.,
1,75% of Christians are actively involved in voodoo.,
0,"A ""Rabbi"" trust in a non-qualified plan keeps plan assets from the employer's creditor in the vent of bankruptcy",
1,A 401k allows for pre-tax contributions by the participant,
1,"A balance sheet shows cash, $75,000: marketable securities, $115,000; receivables, $150,000 and $222,500 of inventories. Current liabilities are $225,000. The current ratio is 2.5 to 1",
1,A bankruptcy is a matter of credit history record for ten years.,
1,A banner ad that does not deliver a high level of response may still be effective in building brand awareness,
0,A bell shaped curve is an example of a skewed distribution,
1,A beta polysaccharide would be used as a structural compound.,
1,A big advantage of soleproprietorship and partnership is that business earnings are taxed only once---as income to the business owners.,
1,A blackbody emits a continuous spectrum,
1,a business in a purely competitive market has no control over price if it wants to sell its products,
0,a business schedules its hours to provide place utility,
0,"A business using the perpetual inventory system, with its detailed subsidiary records, does not need to take a physical inventory",
1,A C program begins with a section of preprocessor directives,
0,A camel was a clean food for the Israelites,
0,a canon is type of homophony,
0,"a career requires very little planning, education, and preparation",
1,A cashier's check is a form of check in which the bank is both the drawer and the drawee,
0,A cell can maintain a non-equilibrium steady state for a substance X only when some actively transporting mechanism can compensate for the passive movement of X and prevent the intracellular and extra cellular concentrations of X from changing with time,
0,A cell performs work by transporting a certain number of molecules along a concentration gradient,
1,a certified check guarantees that your account can cover the check,
1,A change in the cost of a resource used to make a good will affect the supply of the good.,
1,A change of the system from initial to final state can be achieved through many ways that differ from one another in the amount of work required,
0,a channel of distribution moves materials from consumers to manufacturers,
1,A character constant is enclosed in double quotes,
1,A check is a draft drawn on a banks and payable on demand.,
0,A chromosome is all the DNA that is used to make one protein.,
1,"a circus layout combines lots of elements-art, type, color- to deliberately create a busy jumbled image",
0,A client should never consider converting a traditional IRA to a Roth IRA either at or after normal retirement,
0,a company reaches the break-even point when it buys more merchandise than it sells,
0,a competitor's market position does not affect the company's success,
1,A conditional guarantor of collection differs from an absolute surety in that the surety is bound with the principal debtor as a primary obligation.,
1,a consumer may be aware of products but not make a purchase until the need exists,
1,A consumer's % daily values may be higher or lower than those shown on nutrition labels,
1,a cover letter should encourage you employer to read your resume and increase your chances for obtaining an interview,
0,"a credit union is a financial institution that serves individuals and businesses with a wide variety of accounts, loans and other financial services",
1,A creditor will have to exhaust all the possible legal procedures to try to collect from the principal debtor before he can collect from a conditional guarantor of collection.,
1,A cricket was a clean food for the Israelites,
1,"A critical factor in perception is relevance, which means the message connects on some personal level.",
1,A crowd is characterized social logically as a collective action,
0,A debtor filing for Chapter 7 bankruptcy must provide a list of all immediate family members because persons such as spouses may be liable for the bankrupt person's debts.,
1,a decision can be evaluated by determining the satisfaction it delivered,
1,"A decrease in the price of soda affects your real income, not your money income.",
0,A defined benefit plan can be amended into a DC plan False,
0,A defined benefit plan can not be terminated in favor of a defined contribution plan,
1,A defined benefit plan provides guaranteed benefits for its participants,
0,A defined benefit plan that is under-funded can be terminated by the plan sponsor,
1,A defined contribution plan has no PBCG insurance for its participants,
1,a demand curve demonstrates the relationship between price and the quantity demanded,
1,A diagonal divides a square into two isosceles right triangles,
0,A dissolve is the most common type of join,
0,A distribution that is one of a stream life annuity payments from a qualified plan is eligible for a rollover distribution,
0,a dividend is not actually a share of a company's profits,
1,A federal budget deficit measures the amount by which the federal spending exceeds total federal revenues.,
1,A fiduciary is anyone who has control and authority with regard to the retirement planning,
0,A fiduciary is only responsible for losses that they personally cause to a retirement plan,
0,a final consumer buys goods and services to produce and market other goods and services or for resale,
1,A financial/ retirement planner should always hold the needs of their clients above their own,
1,A firm faces two kinds of costs in the short run: fixed cost and variable cost.,
0,A focus group can be used to discover key consumer insights but not good for copy testing,
0,a follow-up letter should be sent to the employer after an interview only if you are offered a job,
0,A function that passes at least one parameter by address must pass them all by address,
0,A gas with a high molar mass will travel though a small opening faster than a gas with a low molar mass,
1,A genre is a category or type of music repertory,
1,A goat was a clean food for the Israelites,
1,A good experiment is one where both alpha and beta are low,
1,a good way to save successfully is to make saving a regular payment from each paycheck,
1,A greater percentage of Americans are covered by Social Security today than ever before,
1,A guitar is an example of a chordophone,
1,"a hetemrophpnic texture frequently occurs in music involving improvisation, such as jazz",
1,A hexose sugar and a pentose sugar would both be examples of monosaccharides.,
0,A higher minimum wage lowers the opportunity costs of staying in school.,
1,A higher price makes producers more willing and better able to increase quantity supplied.,
0,A histogram is like a bar graph except with a histogram the bars don't touch each other,
0,A hydrate is a compound that reacts violently in the presence of water,
1,"a key is a group of related tones with a common center, the tonic, toward which the other tones gravitate",
0,a kite has 2 pair of parallel sides,
0,A lamb is sacrificed instead of Isaac,
0,A laser guide star is a true star,
0,A leftward shift of the demand curve indicates that consumers are more willing and able to buy a good at each price.,
1,A life annuity is an appropriate benefit for the individual who wants the guarantee of the highest lifetime payment but who has no need to provide retirement income to a spouse or other dependent,
1,A limited amount of control structures are permissible in the main function to ensure that it is the main function which makes most of the function calls for a program,
1,a linear pair of angles share a common side,
1,A literal constant is an unnamed constant used to specify data,
1,"A living cell reduces its entropy at the expense of its environment, using information processing",
1,A local variable cannot be reference through its identifer outside of the function in which it is defined,
0,A lump sum distribution from a 403b cannot be rolled over into and IRA,
1,A major advantage to covering employees in a retirement plan is retention and loyalty,
1,A major criticism of the continental drift hypothesis was the apparent lack of a driving mechanism,
1,a major scale can begin on any of the twelve semitones of the octave,
1,A majority of the states have passed legislation establishing a cooling-off period during which the consumer may void a contract to purchase goods and services.,
0,A marriage squeeze occurs when too many eligible marriageable males exist in the population but not enough women,
0,A match-on-action and an eye-line match are essentially the same thing,
1,A meal manager should read through a recipe before he/she begins to prepare it,
0,A meal manager will generally need to prepare separate meals for a family member with health problems that affect food needs,
0,a measure of 132°.,
0,A mechanic's lien is also called an artisan's lien.,
0,A mechanic's lien is the most common lien on personal property,
0,A mediater settles disputes between management and labor by listening to both sodes and posing settlements on both parties,
0,A molecule that increases the pH of a solution is called an acid.,
0,A montage sequence is the same as montage editing,
1,A movement is a complete comparatively independent division of a large-scale work,
1,"a musical form based on a statement, a departure, and a restatement of the first idea is called binary",
1,A musical note is the symbolic representation of a sound with pitch and duration,
1,A natural energy can be so effective that it causes the extinction of it's prey or host.,
1,A need-satisfaction question can help move the sale forward.,
0,"A negotiable instrument is a promise by one party to pay a undefined sum of money to another party. There are two parties: the maker and the payee. While the amount to be paid may vary, the date of payment must be set at a specific time in the future.",
1,"A negotiable instrument may be transferred in two basic ways. If the instrument is made ""to the order"" of the payee, the payee must (1) endorse the instrument and (2) deliver the instrument to a third party. If the instrument is made ""to bearer,"" the party in possession of the instrument is required only to deliver it to transfer it.",
1,A nested loop is a repetive process contained inside of another repetitive process,
1,A non-qualified plan must include a risk of forfeiture to avoid constructive receipt,
0,A normal random variable is an example of a discrete random variable.,
0,"A note involves two parties, the maker and the payee. Payments must be on demand.",
1,A nucleotide has four parts,
1,A nutrient is a chemical substance in food that helps maintain the body,
1,A participant receiving a non-qualifying distribution from a roth IRA can withdraw up to the amount of accumulated contributions without income tax consequences,
0,A peeler is used to shred foods such as cheese,
0,a pentagon has 6 sides,
0,A person who is continuing to work past 70 1/2 at the employer where she has accumulated her 401k must begin distributions by the April after the year she turns 70 1/2,
1,A person's life-span goals change as she or he learns and grows,
1,A person's lifestyle and health play a major part in how much money will be needed for retirement,
1,a phrase is a component unit of a melody,
0,A piano trio is an ensemble of three pianos,
1,A piece of data is called logical if it conveys the idea of true or false,
1,A plate is always made up of a combination of continental and oceanic crust,
1,a popular way to transfer money electronically is through an automated teller machine,
0,A precipitate forms when two aqueous solutions react to form a product that cannot dissolve in water,
1,A primary difference between novice and expert teachers is the experts ability to gather information in a short time and use it in multiple ways.,
1,A priori knowledge is knowledge that is justified independently of experience.,
0,A process during which there is no heat transfer is called an isothermal process,
1,A product labeled with a nutritional claim such as high fiber must meet a standard definition,
1,"A products unit price is the cost per standard unit, weight, or measure",
1,A profit sharing plan may be integrated with SS to provide greater benefits for the highly compensated,
0,A profit sharing plan requires specific annual contributions on the part of the employer,
0,A prototype plan document is designed specifically for one specific plan,
0,A purine may bond with another purine,
1,A qualified plan provides an employer a tax deduction when contributions are made,
0,A racial group is defined primarily by cultural characteristics,
1,A random sample results when each possible sample of a given size has an equal chance of being selected,
1,A raw score that is 1 standard deviation above the mean of the raw score distribution will have a z score of 1,
1,a ray has one endpoint,
0,A reaction is at equilibrium when the rate of the forward and reverse reactions are unequal,
1,A religious organization marked by bureaucracy training highly codified beliefs and elaborate rituals is called Church,
0,A rise in consumer use of label information is prompting food manufacturer to stick with product recipes that have sold well for years,
0,A salesperson's performance evaluation based entirely on qualitative and quantitative items of measurement is an unfair method of assessment.,
1,A sample is a subset of a population,
1,A sand bar in a river is an example of a landform created by deposition,
0,a sharp lowers a musical tone y half a step,
1,"A short melodic, rhythmic, or harmonic pattern repeated throughout a musical work is called an obstinate",
1,A shortage puts upward pressure on price.,
0,A single piece of newspaper burns faster than a shredded piece,
1,a single product can fill more than one need,
1,A single type operation will generate a result of that same type,
1,a single-voiced texture is called monophony,
1,A skinfold test can help determine whether excess weight is due to fat or muscle,
1,A social program that encourages teenagers to stay in school and graduate is typically of the social problems perspective.,
1,A soleproprietor is fully responsible for all the firm's losses.,
0,A sound bridge is another way of describing a dialogue hook,
0,A sphere is rolling downhill. It is moving spontaneously from a position with a lower potential energy to one with a higher potential energy,
1,A spontaneous process is a physical or chemical change that occurs with no outside intervention,
1,a square is a regular polygon,
1,a square is an equilateral rectangle,
0,A street family attempts to uphold decent family values.,
0,A structure chart should be created after your program has been written,
1,A substance diffuses in the direction that eliminates its concentration gradient at a rate proportional to the magnitude of this gradient,
1,A substance does not change in temperature while it is undergoing a change in state,
1,A substantial proportion of people in less developed countries do not have access to safe drinking water.,
0,a successful budget requires very little accurate record keeping,
0,a supply curve and demand curve should never intersect,
0,A surety agreement must always be in writing to be effective.,
0,"A system is set to be in thermodynamic equilibrium when any of its properties such as temperature, pressure, volume etc change with time",
1,A target defined benefit plan is a defined contribution plan that looks like a defined benefit plan,
1,A teacher's expectation that all students can succeed greatly affects student's achievement.,
0,A teacher's religious views should have no influence on his or her philosophy of education.,
0,A tempo marking indicates the loudness of a piece of music,
1,A theory is tested by how well it describes and predicts reality.,
1,A theory that attempts to explain all types of criminal behavior is a general theory of crime.,
1,"A Thermodynamic system is separated from the rest of the universe by a membrane, which delimits a finite volume and through which heat or other forms of energy may pass",
1,"A thermodynamically unfavourable reaction can be driven by a favorable reaction, both reactions together having a net negative difference in the free energy",
0,A total of 1000 earthquakes are estimated to occur worldwide each year,
1,a trade publication is an example of an information service that a business could use to gain competitor information,
1,A translator system is in a steady state when both the driving forces acting on it and the rate of transport do not change over time,
0,a trapezoid is a parallelogram,
1,a triad is a chord made up of three tones,
0,a triangle can have 2 right angles,
0,a triton scale is made up of eight notes,
1,A user defined function may be called more than once in a program,
0,a utility company usually operates in a pure competition enviornment,
0,A variable declared in the local declaration section of a function can have the same identifier as one of the parameters of the same function,
1,A variable declared in the local declaration section of a function has a scope that extends until the end of the function,
1,a variety of world musics make use of pentatonic scales,
0,A weight management plan is unnecessary once a person has reached his/her weight goal,
0,A well written recipe should list ingredients in alphabetical order,
1,A working model can be a satisfactory substitute for demonstrating the product itself.,
0,A z distribution always is normally shaped,
0,About two-thirds of American eighth-grade students score at the proficient or advanced level on the National Assessment of Educational Progress in mathematics and science.,
0,Abraham is 85 when God first appears to him,
0,Abram and Sarai have to go to Goshen because of a famine in the land,
1,Abram is circumsized the age of 99,
0,Abram pretends to be Sarai's sister so that the pharaoh will not kill Abram,
1,Accelerated editing involves shortening the length of each consecutive shot,
1,"According to agency theory, event-causation describes events that are determined.",
1,According to Andrew Cherlin one cause of marriage deinstitutionalization is the change in norms about having children within the context of marriage and the family,
0,according to apa children under 10 usually do not understand the persuasive intent of advertising,
1,"According to attachment theory, delinquent behavior raises when nonsecure attachments are created.",
0,"According to differential opportunity theory, a lower class youth who becomes addicted to drugs is probably involved in a conflict subculture.",
1,"According to Ferracuti and Wolfgang, violence may be a learned form of adaptation of certain life circumstances.",
1,"According to general strain theory, strain may occur when you are presented with negatively valued stimuli.",
1,"According to Kierkegaard, there is a difference between knowing about God and having faith in him.",
1,"According to Nielson, 77% of wireless service subscribers in the US own a smart phone device in the fourth quarter of 2014",
0,"According to Plato and the traditional definition of knowledge, having a true belief is sufficient to have knowledge.",
1,"According to Plato, since justice is not something that can be perceived, we can only have different opinions about it, but not knowledge.",
0,"According to Plato, there is no truth about justice, for everyone has a different opinion about it.",
0,according to prof don shultz the goal of IMC is to generate longterm financial returns and build short-term brand and shareholder value,
1,"According to psychological theories, the primary unit of analysis is the individual.",
0,"According to routine activities theory, the presence of a capable guardian is a necessary element for a crime to occur.",
1,"According to rules theory, romantic partners should acknowledge each other's individual identities and lives beyond the relationship",
1,"According to Sartre, ""transcendence"" refers to the fact that our lives are defined by the possibilities we face and the choices we make.",
1,according to the american marketing association advertising is a marketing activity/ process for creating communicating...,
1,"According to the authors of How to Hire and Develop Your Next Top Performer, about half of the people working in sales should be doing something else.",
1,"According to the book, the population of developed countries will remain somewhat stable over the next 40-50 years.",
