Answer,Question,
1,The heat required to vaporize one mole of a liquid is called its molar enthalpy of vaporization,
1,The hidden curriculum is a term that refers to a schools unofficial rules by which students learn various behaviors attitudes and values,
0,the hierarchy of needs was developed by Isaac Newton,
0,The higher the activation energy that faster a reaction will proceed.,
0,"The higher the income of a bankrupt, the more likely the debts will be discharged by Chapter 7 bankruptcy rather than by debt repayment over time.",
0,"The higher the Km, the higher the apparent affinity of the transporter for the Solute",
1,"The higher the partition coefficient of the substance, the more easily it will be able to cross the membrane lipid barrier",
1,"The higher the r value, the lower the standard error of estimate",
0,"the higher the rate of interest, the less income you deposit will earn",
1,The Himalayan Mountains were produced by a collision of India with Asia about 40 million years ago,
1,"The hotter an object, the bluer it appears",
1,The human population is exploding because we have effectively decreased our environmental resistance.,
1,The human population is exploding because we have effectively increased our biotic potential.,
1,The hydrolysis of ATP releases free energy only when it is coupled with other cellular processes that require free energy,
1,The hydrophobic bilayer membrane is a barrier to inorganic ions and is also a poor conductor of electricity,
1,The impossibility to construct a perpetual motion machine led to the universal acceptance of the principle of conversation of energy,
1,The inability to control mitosis is associated with cancer development.,
1,the incenter is equidistant from each side of a triangle,
0,The increase in entropy involves an evolution from more probable configurations to less probable,
1,The increasing integration of previously isolated events and their overlapping impact on people is a key aspect of globalization.,
1,The index value represents an offfset from the beginning of the array to the element being referenced,
1,"The Indian church currently sends over 80,000 missionaries.",
1,The individual task represented by a function should be a testable apart from the rest of the program,
1,The Indonesian church has grown spectacularly in the last generation and now forms over 5% of the population.,
0,The influence of the Catholic Church (in Honduras) is strong and growing.,
1,"The influx of a substance by simple diffusion increases nearly with the increase in substance concentration, with no maximal rate of transport",
0,The information on the numbers of micro states in a given macro state is contained in a function known as mathematical probability,
0,the information that can be provided in an advertisement is unlimited,
1,The initialization of the loop control variable must take place outside the body of a pretest loop,
1,The insertion sorting algorithm begins with one value in the sorted list before the first pass,
1,The intensity of the U.S. buisness cycle varies from region to region across the United States.,
1,The interaction of phospholipids with water is referred to as amphipathic,
0,The interior of Earth consists almost entirely of molten rock,
1,The intermolecular force between molecules of oxygen is dipole-dipole in nature,
0,The internal energy is a state function and depends on the way in which the state has been achieved,
1,The internal energy is an extensive property of a system while the internal energy per mole is an intensive state property of that system,
0,The internal energy of a system will increase if that system performs work against external objects,
0,The internal energy of an ideal gas is a function of temperature and pressure,
1,The internal energy U of a system may change if the number of the particles of the system changes,
0,The introduction of solid foods into a baby's diet usually begins with strained meats,
0,The investment risk in a cash balance plan is the responsibility of the participant,
0,The ions that can be observed forming a precipitate are known as spectator ions,
0,The IRS is the only government agency involved in the oversight of retirement plans,
1,the IRS will not consider a tax return filed if it is not signed,
0,The Islam practiced in Mali is amongst the most oppressive found on Earth.,
0,The island of Hawaii experiences volcanism because it is located above the Mid-Pacific Ridge,
1,The Israelites had certain laws in place regarding leprosy,
1,The journal entry to record the purchase of treasury stock will cause total stockholders' equity to decrease by the amount of the cost of the treasury stock,
0,The Kelvin temperature scale is measured in degrees,
0,The Kenyan church has virtually no missionary vision.,
1,The key element in the contemporary street code is the issue of respect.,
0,The Keynesian approach of the 1960's can be considered simply-side economics.,
1,The kinetic molecular theory assumes that the distance between the particles of a gas is so large that there are no significant attractive or repulsive forces,
1,The kinetic molecular theory describes the behavior of matter in terms of particles in motion,
0,the kinetics of facilitated diffusion for substrates can be described by fick's law,
1,The knowledge of early civilizations and the culture of the Middle Ages were preserved largely in monasteries,
0,The large free energy change of ATP hydrolysis can be coupled with other reactions that have negative free energy changes,
1,"The larger the difference between the cations and anions mobilities, the larger the diffusion potential",
1,"The larger the epicenter of the wave, the more severe the damage will be",
0,The largest city is Calcutta.,
0,The last miracle on earth by Jesus was the raising of Lazarus,
1,The last of forest land leads to soil erosion and loss of animal habitat,
0,The last stage of the perception process is memory.,
1,The law governing bankruptcy is federal statutory law.,
1,The law of conservation of energy states that energy in neither created nor destroyed,
0,the law of demand says that consumers will demand less of a product at a lower price than at a higher price,
1,The law of gravitation is termed universal because it is a property of all material objects,
0,the least amount of sides a polygon can have is 4,
1,The legalistic perspective defines crime as a violation of the criminal law.,
0,"The libertarian would agree with the compatibilist on the definition of ""free actions.""",
0,"the life-span goals you set do not affect your family, future family, and community",
1,The limiting reagent limits the amount of product formed in a chemical reaction,
0,The line between classical and popular music is clearly defined,
0,The linear and binary searching algorithms perfrom in the same amount of time when a target value is not present in an array,
1,The logical AND operator is true only when both operands are true,
1,The logical conclusions which led to the derivation of the Boltzman equation are the same as those on which the Shannon relation is based,
1,The logical expression of an if...else construct must be enclosed in parentheses,
0,The logical OR operator is true only when exactly one of its operands is true,
1,The loop control variable is responsible for terminating the loop because it will eventually result in the loop control expression being false,
0,The Lord's Resistance Army is very much like the Salvation Army.,
1,The lower the viscosity of a lava the more likely it is to produce an effusive eruption,
1,The lunar tides on Earth are making the Moon recede from Earth,
0,The magma that is created by ocean-continent convergence forms either island arcs or belts of igneous activity on the edges of continents called volcanic arcs,
1,The main difference between rationalism and the scientific method is that the scientific method relies on objective assessment to test the idea,
1,The main function is the starting point for execution of the program,
1,The main reason that small corporations adopt qualified plans is to benefit the owner employees,
1,The main source of paid-in-capital is from issuing stock,
1,The major outcome of a business agreement based on reciprocity is a mutual exchange of benefits.,
1,The majority of English language learners were born in the United States and are US citizens.,
1,The majority of Honduras' population is children and more than half of them live in poverty.,
0,The majority of Indian churches are pastored by foreign workers.,
0,The majority of people who enter the US illegally with assistance are trafficked rather than smuggled into the country.,
0,The majority of the believers in North Korea are in state-controlled churches.,
1,The mall is an example of a cathedral of consumption,
0,The mantle is molten metallic layer surrounding the inner core,
1,the marketing mix is developed to meet the wants and needs of a company's consumers,
1,the marketing process is more scientific than creative,
0,The Marxist government of Ethiopia in the 1970's was one of the few to be quite tolerant of the Christian Church.,
1,The mass of a dalton is basically the same as the mass of a neutron,
0,The mathematical probability P is defined as follows: P= greatest posible number of cases / number of favorable cases,
0,The max number of actions that can be associated with a switch case label is one,
0,The maximum annual compensation that can be used to calculate retirement benefits in 2017 is $300k,
0,The maximum loan a persona can take from a 401k plan in 100% of the current value with a cap of $250k,
1,The mean of the t distribution equals 0 for all sample sizes,
1,The measure of each angle of a regular dodecagon is 150°,
1,The medical profession has gotten more diverse over the last 50 years but white males still make the highest starting salaries on average,
0,the melody of The Star-Spangled Banner is best described as conjunct,
0,"The membrane pores of the Bowmans capsule in the kidneys are very small and only albumin, the smallest of the proteins, is filtered through",
1,The membrane pores of the liver cells are extremely large and allow a variety of solutes to pass through and be metabolised,
1,The membrane potential of the cell is due to the presence of all the ions,
0,The membrane potential persists until the concentration difference becomes zero,
1,The Messianic prophecy reveals that the Messiah will come from David's line,
1,The mid-ocean ridges are elevated above the surrounding seafloor because ridge rocks are hot and therefore have relatively low density,
1,The middle school years are characterized by a growth in independence and social interests.,
1,The military regime seeks to destroy Christianity.,
0,The mineral class that makes up more that 95% of the continental crust is termed the oxides,
1,The minimum amount of energy needed by the reactant to form the activated complex and lead to a reaction is known as activation energy,
1,"The minimum distribution rules apply to qualified plans, 403b annuities, 457 plans, traditional IRAs, SIMPLE and SEPs",
1,The mitochondria is believed to be the symbiont in the endosymbiosis Theory,
1,"The mitochondrion plays a central role in the process called apoptosis, or programmed cell death",
1,The mobility of a non charged substance is defined as the velocity per unit driving force,
0,The modern symphony orchestra is typically made up of twenty to thirty players,
0,The modes were developed from the major and minor scales,
1,"The mole ratio is a comparison of how many moles of one substance are required to participate in a chemical reaction with another substance, based on the balanced chemical equation",
0,The monastic life was reserved for men only,
0,"The more mobile the anion is, the more dilute side will be at a positive potential relative to the more concentrated one",
0,"the more often interest is compounded, the less interest you make",
0,"The more valuable the collateral backing up the loan, the higher the interest rate charged on that loan.",
1,The mortgagee is the creditor who makes a mortgage.,
1,The most commanly used measure for the economy's size is the gross production.,
0,The most common bankruptcy proceeding is known as adjustment of debt.,
1,the most difficult type of competition businesses face is a market in which businesses compete with others offering very similar products,
1,"The most frequently prescribed cardiac drugs inhibit the (Na+-Ka+) ATPase. The resultant increase in (Na+) stimulates the cardiac (Na+-Ca2+) anti-port system, boosting CA2+ in the sacroplasmic reticulum, thereby intensifying the force of cardiac muscle contraction",
0,The most important aspect of a teachers effectiveness is his or her personality.,
1,The most influential and most complex form of business of business organization is the cooperation.,
1,The most likely consequence of frustration is direct aggression toward others.,
1,The most recently invented member of the woodwind family is the saxophone,
1,The most widely reported measure of the nation's economic health is the unemployment rate.,
1,The Muslim population of Indonesia is fragmented and less zealous than in the Middle East.,
1,The name of an array is a primary expression whose value is the address of the first element in the array,
1,The name of an array is a reference to the address of where it beings inside the memory of the computer,
1,The name of the external file being accessed is case sensitive when referenced in the fopen function call,
1,The national advertising division and national advertising review board...,
0,"The National Education Association and the American Federation of Teachers, professional organizations that represent the majority of the nation's teachers, neither take positions on political issues nor endorse individuals running for office.",
1,The NCvs does not include information on crimes against children under the age of 12.,
0,The neap tides can only occur when the Moon's position is at or near one of its orbital nodes,
1,The Nernst potential for each ion in a cell can be computed individually,
1,The net entropy increases when heat flows spontaneously from hot to cold region,
0,The normal condition of cells includes a low intracellular concentration Cl- and a high intercellular concentration K+ compared to the extracellular space,
1,The normal curve never touches the X axis,
0,The normal curve reaches the horizontal axis in 4 standard deviations above and below the mean,
1,The normal deviate test uses the mean of the sample as a basic statistic,
0,The nucleus of the hydrogen atom consists of a single neutron,
0,The number of students in a class is an example of a continuous variable,
1,The octet rule states that atoms combine in order that each may have their outer energy level containing eight electrons,
0,"The only property that is typically exempt from attachment is personal property worth over $1,000.",
0,The only value of random sampling is to achieve a representative sample,
0,The only way to stop a program caught in an infitinte loop is to shut down your terminal software,
1,The operand in a postfit or prefix expression must be a variable,
0,the opposite of pure competition is oligopoly,
0,"The orbitals of the ""s"" shell and the ""p"" shell are similar in shape",
1,The order in which the operators in an expression are evaluated is determined by a set of priorities known as precedence,
1,The order of church services and the structure of each service are known as the liturgy,
0,the orthocenter is also known as the center of gravity,
0,the outpatient portion of a policy covers treatment after you have been admitted to the hospital,
0,the overall shape of a melody is called its range,
0,The oxidation of glucose to carbon dioxide and water is no spontaneous since it is accompanied by a large negative free energy change,
1,"The paradox of hedonism is the fact that if your only goal is to find pleasure or happiness, you are unlikely to find it.",
1,The party to receive a payment from a negotiable instrument is called the payee.,
1,"The party who agrees to make a payment to another party, based on a document presented to it, such as a bank, is called the drawee.",
1,"The party who issues or creates a document that requests payment, probably from a bank is called the drawer.",
0,The PBCG can never force plan termination,
0,The PBCG guarantees the benefits of 401k plans,
1,The Peace of Westphalia officially recognized Calvinism.,
0,The people cry out for a king when Joshua dies,
1,"the people that you support financially, such as children, are dependents",
0,The percent yield is the maximum amount of product that can be produced from a given amount of reactant,
1,The percentage of indviduals who are undernourished has declined in the past 30 years.,
1,"The percentage of teachers reporting to be ""very satisfied"" with their choice of teaching as a career has almost doubled in the last 25 years.",
1,The percentile rank of a score is equal to the percentage of scores in the distribution that fall below the score in question,
0,The perpetrators of environmental racism come only from outside developing countries.,
0,The Persians conquer the Babylonians and the Assyrians,
0,The personal distance is the closest of all of Halls four distances and ranges from the close phase of actual touching to the far phase of 6 to 18 inches,
1,The Philippines has a large—more than 10%—evangelical population.,
1,The Philippines is a rarity in Asia-a majority-Christian nation.,
1,The Philippines is awash in false cults.,
0,the phrases in the tine Amazing Grace are of unequal length,
0,The piano is limited by a narrow range of pitches and dynamics,
0,The pluralistic perspective is most applicable societies characterized by a shared belief system.,
1,The population that is most vulnerable to the spread of HIV aids is the least likely to have access to high-quality healthcare and expensive drugs that can slow the progress of the disease,
1,The portion of a fracture zone between two offset portions of a ridge crest is called a transform fault,
0,The Portuguese were able to dominate in the Indian Ocean because they could arrange diplomatic missions.,
1,The Portuguese were able to dominate the Indian ocean because they could mount cannons on their ships.,
1,The power of the test is the likelihood of rejecting the null hypothesis when it is false.,
1,The PPF has a bowed-out shape due to the law of increasing opportunity cost.,
1,The precision modifier may be used for the output of any numeric value,
1,The preprocessor is a part of the comiling process and prepares your code for the remainder of the process,
1,"The pressure, temperature and chemical potential are the generalised forces, which drive the generalised changes in volume, entropy and particle number respectively",
1,The price-earnings ratio is a commonly quoted ratio is a commonly quoted ratio by the financial press,
1,the pricing strategies of your direct competition are valuable knowledge for your business,
0,The primary difference between breccia and conglomerate is that conglomerate is finer grained than breccia,
1,The primary distinction between acts of terrorism and violent crimes revolves around the political motivation of the offenders.,
0,The primary focus of trust in transactional sales is trust in the person who sells the product.,
0,The primary sequence of a protein changes as the pH changes.,
1,"The principal statements of a corporation are the income statement, statement of retained earnings, statement of cash flows, and the balance sheet",
1,the principle of organization around a central tone is called tonality,
1,The principle of utility defines a right action as one that produces as much good for as many people as possible.,
0,The process of ATP losing a phosphate is nonsponateous,
1,the process of passing from one key to another is known as modulation,
1,The proton gradient across the inner mitochondrial membrane is maintained by the action of electron transport chain,
0,The Ptolemaic model of the universe was heliocentric,
1,The punctuation of communication is the segmenting of the continuous stream of communication into smaller pieces.,
1,The purpose of the Chartist movement was to get the English House of Commons to pass the Six Acts of the People's Charter.,
0,the quantity of a product that producers are willing and able to provide at a specific price is demand,
0,The range of a correlation coefficient is 0 to +1,
1,The rate of chemical reaction is unrelated to the spontaneity of the reaction,
0,The rate of diffusion of a substance through a membrane does not depend on its solubility in the membrane's nonpolar core,
0,The rate of diffusion of NO2 is greater than NO3,
0,The rate of facilitated diffusion is generally much lesser than that of simple diffusion,
0,The rate of heat transfer is the amount of heat transferred per unit area,
0,The rate of sea floor spreading averages about one meter (3 feet) per year,
1,The rate of the chemical reaction is defined as the change in concentration of a reactant or product in a given time interval,
1,"The reaction A<==>B occurs in a closed system. When the reaction reaches equilibrium at temperature T, the number of molecules changing from A to B is equal to the number of molecules changing from B to A",
1,The reason that the C language does not pass whole arrays by value is the extra stress it would put on the memory of the computer to make a copy of an array,
0,The recommended dietary allowance are the values that appear on nutrition labels on food products,
0,The relationship between the entropy and the number of micro states is given bye delta S= k ln W2/W1,
0,The release of epinephrine when frightened is an example of gene regulation,
1,The removal of detritus (sediments) from weathered rock at an outcrop is termed erosion,
0,The Renaissance is the earliest musical period in the Western tradition,
1,The rest of the world affects what U.S. households consume and what U.S. firms produce.,
1,The restatement of a theme or motive at a higher or lower pitch level is known as a sequence,
1,The retirement/ financial planner is responsible for assuring that their client's interests are always primary in all of their recommendations,
1,The retreats mode of adaptation is associated with drug use.,
0,the return statement cannot contain an expression,
1,The return statement in main will return control to the operating system and will terminate the program,
0,The revenue recognition concept states that revenue should be recorded in the same period as the cash is received,
0,the rhyme scheme of a poem is determined by the first word of each poetic line,
1,The Right to Be Heard states that the government must consider consumer interest when creating laws,
0,The Right to Consumer Education makes certain that consumers have a variety of goods and services to chose from,
1,The Right to Redress promises that consumers should be able to obtain fair remedies to consumer problems,
1,THe role of the main function is to coordinate the function calls and to establish the data needs for a program,
1,The role of the salesperson is to diagnose buyer need and determine how to extract value from the situation.,
0,The role of the trustee is to minimize the amount of the debtor's assets available for distribution to creditors.,
0,The Roman Catholic Church has been a powerful enemy of Evangelicalism.,
0,The Romans are in control in the Old Testament comes to an end,
1,The Romans are in control when Jesus is born,
0,The S cooperation was formed to take advantage of limited tax liability by limiting revenue and profit.,
0,The S represents free energy,
0,The safety closures used on many medicines and household chemicals make the bottles impossible for children to open,
0,"The sales manager should not change the compensation plan, even if conditions in the marketplace warrant change.",
0,"The sales manager who appraises the performance of his/her sales personnel regularly is displaying the leadership quality known as ""consideration.""",
1,"The sales manager who makes decisions promptly and firmly is displaying the dimension of leadership described as ""structure.""",
1,"The sales manager who treats each member of the sales force as an individual is displaying the dimension of leadership described as ""consideration.""",
1,The salesperson should personally inspect all equipment and products before his or her sales presentation to ensure everything is working properly.,
0,The salesperson should use a standard entertainment activity for all customers to avoid the appearance of favoritism.,
0,The sampling distribution of the mean is always normally distributed,
0,The sampling distribution of z is always normally distributed,
1,The Sanhedrin influence the crowd to choose Barabas,
0,The Sanhedrin want to make Jesus' arrest something public for all to see so that a lesson will be learned by his followers,
0,The sea floor is older than the earth,
0,the second law of thermodynamics is the law of conservation of energy,
0,The selection of an inventory costing method has no significant impact on the financial statements,
0,The selection sorting algorithm can only be used to sort data in an ascending order,
1,The selection sorting algorithm will complete one exchange involving at most two elements per pass,
0,The self-serving bias is when you take credit for the negative and deny any responsibility for the positive..,
0,The short-circuit method of evaluating logical expressions does not apply to loop control expressions,
1,the shortest distance between a point and a line is measured along a perpendicular,
