Answer,Question,
1,"In preparing the cash flows from operating activities section of the statement of cash flows by the indirect method, the net decrease in inventories from the beginning to the end of the period is added to net income for the period",
1,in pure competition there are a larger number of suppliers offering very similar products,
0,In retirement your living expenses are always reduced,
0,"In secondary active transport, the free energy of the electrochemical gradient generated by another mechanism, such as an ion pumping ATPase, is used to transport a neutral molecule along its concentration gradient",
1,"In setting up a corporate plan, the employees of the company must be notified",
1,"In some cases, it is not practical to demonstrate the product itself.",
1,"In some countries, the study of crime is taboo.",
1,"In spite of enormous financial resources, high employee morale, and wise management southwest airlines have to adopt a diversified marketing strategy when faced with fierce competition and strict government regulation",
1,"In systems near thermodynamic equilibrium, all forces and fluxes are coupled with each other",
0,"In terms of aggregate demand and aggregate supply, the great depression cam be viewed as a rightward shift of the aggregate demand curve.",
1,In the 1970s one of the biggest fears was the onset of Global Cooling.,
0,"In the 1990s, Argentina expelled nearly her entire Jewish population",
1,"In the book of Joshua, the enemies fall to the Israelites because of the faith of the Israelites in God",
1,"In the case of a global thermodynamic equilibrium, the function of free energy indicates only one minimum",
1,"In the case of a local thermodynami equilibrium, the energetic function indicates two or more minima which are separated by more or less large energy barriers",
1,"In the fact finding process, it is important to find out about special needs dependents",
1,In the microphysical world the so-called effective parameters are used,
0,In the past 50 years economic growth has been about the same as population growth.,
0,"In the priority of classes of creditors, taxes owed to the government come before any other payments.",
0,"In the silicon-oxygen tetrahedron, there are more silicon atoms than oxygen atoms",
0,"In the US, the risk of stranger assault is high.",
0,In this course you will be expected to validate for the input of both the range of acceptable values and the correct data type,
0,"in western music, the octave is divided into seven equal parts, which make up the chromatic scale",
1,Increased levels of testosterone may be linked to increase aggressiveness in men.,
0,Increases in social cohesion are associated with increases in violent crime.,
0,"Increasing energy of light goes in the order ultraviolet, visible, infrared",
0,Increasing N affects the magnitude of the effect of the independent variable,
0,Increasing N increases the probability of a Type II error,
1,Increasing N usually results in an increase of power,
0,"Increasing the level of confidence, while keeping everything else the same, will result in shorter confidence intervals",
1,"Increasing the sample size, while keeping everything else the same, will result in shorter confidence intervals.",
1,Indexed references to individual elements of an array are simply calculated addresses where the inex value is added to the address represented by the name of the array,
0,India is 95% Hindu.,
1,India is the most ethnically diverse nation on earth.,
0,India's constitution places severe restrictions on all non-Hindu religious groups.,
1,India's economic growth exploded by going to a free market system in the early 90s.,
0,India's population is actually declining.,
1,indirect competition occurs when a business competes with a product that is outside its product classification group,
0,indirect competition occurs when two brands of similar products are compared,
1,Indonesia has a democratic government.,
1,Indonesia has the greatest presence of missionary pilots of any nation on earth.,
1,Indonesia has the world's second largest rainforest,
1,Indonesia in a land racked by natural disasters.,
0,Indonesia is as rich as most European countries.,
0,Indonesia is predominately Hindu.,
1,Indonesia is the fourth most populous nation in the world.,
0,Indonesia was originally colonized by the French,
0,Indonesians of Chinese descent are the most resistant to the Gospel.,
0,Industrialization and trade have increased many economies dependence on land fertility.,
0,Inflation is only a factor during the accumulation phase of retirement planning,
0,Inflation is only a factor in pre-retirement planning,
1,Inflation is when prices increase and the purchasing power of a dollar decreases,
0,Ingredients are listed alphabetically on food labels,
1,Input validation is an example of an event controlled problem,
1,Institutional racism can be found within the educational and healthcare systems,
1,Instrumentality refers to the fact that the type of weapon used in a particular encounter has an effect on whether the encounter ends in death.,
0,Interferometry connects two or more separate telescopes only in the optical band of the electromagnetic spectrum,
0,Interferometry is easiest to use with telescopes that observe at very short wavelengths,
0,International trade between the United States and the rest of the world has decreased in recent decades.,
0,internet can only be used for direct response advertising,
0,Interpersonal conflict can only lead to negative effects,
0,Interpersonal conflict occurs only when relationships are in trouble,
0,Intuition is often used as part of scientific method,
1,investors expect businesses that operate on the internet to earn a profit like the more traditional businesses,
1,"Ion channels allow the passage of simple ions like hydrogen, potassium or sodium through the plasma membrane by passive diffusion",
1,Ion channels are selective for particular ions,
1,Ion channels introduce a conductance pathway into the membrane and lower its resistance,
0,"Ionophores decrease The membrane permeability to the selected ion by binding it, diffusing through the membrane, and releasing it on the other side",
1,Ions in solution in the context of biological cells experience the effect of both concentration and electrical gradients,
0,"Ions may pass through the hole or orifice by passive diffusion, in which case the protein that allows this transport to occur is called a pump",
1,"Ironically, South Africa has seen many Hindus convert to Christianity.",
1,Irreversible transformations are characterized by a net entropy production,
1,"Is a solute concentration is the same on both sides of the membrane but there is an electrical potential difference across the membrane, this electrical potential difference will drive the net movement of the solute, provided that the solute is charged",
1,Isaac is a willing participant in the testing of Abraham,
0,Isaac preferred Jacob because he was a hunter,
0,Ishmael is not blessed by God with many descendants,
0,Ishmael was 12 when he was circumcised by Abram,
0,Islam is virtually absent from the Philippines.,
1,Islamists have destroyed thousands of Christian churches in the last ten years.,
0,"Isotope are molecules that have the same number and kinds of atoms, but are arranged differently",
1,Isotopes of the same element have the same number of protons,
1,Israel made it clear that he loved Joseph more than his other sons,
0,"It is a clear-cut matter that teaching is and always has been not just a career, but a profession.",
1,It is a good idea to field test compensation plans before full implementation.,
0,it is a good policy to record a checking transaction as soon as you find the time,
0,It is a logical error to associate two switch case label with a common set of actions,
1,It is almost impossible for clients to understand some products without a well-planned demonstration.,
0,It is almost impossible for management to develop guidelines for sales personnel regarding the giving of gifts to customers.,
1,It is course standard to make use of { and } with all if-else consturcts,
0,It is dominated by Malaysians but has a large Christian Minority.,
1,It is financially beneficial to save your money in a bank rather than withhold more taxes than you think you owe for the year,
0,It is important for new teachers to work to eliminate the traditional social distance between themselves and students.,
1,"It is legal in American public school classrooms to study religious books, such as the Bible, the Talmud and the Koran.",
1,It is much easier to find and work with variables if they are defined on separate lines,
0,It is never possible to determine if any parameters are passed to a function by address from an example call to the function,
0,It is not necessary for a researcher to present research limitations in the final research report.,
0,It is not necessary to post the closing entries to the general ledger,
1,It is not possible to access a variable in the calling function by its identifier when inside the called function,
0,It is now possible for seismologists to predict an earthquake to within a few weeks or at most a few months of its occurrence,
0,it is possible for 2 lines to intersect in 2 points,
1,It is possible for a valid argument to have false premises and a false conclusion.,
0,It is possible for an invalid argument to have true premises and a true conclusion.,
1,It is possible to determine if any parameters are passed to a function from the declaration statement of the function,
1,It is possible to determine if any parameters are passsed to afunction by address based on the first line of the definition of the function,
1,it is possible to leave your job and continue coverage under your previous employer's insurance plan,
0,It is preferable to use the normal approximation because it is more accurate than the binomial table,
0,"It is technically correct to conclude by ""accepting"" rather than ""failing to reject"" H0",
0,it is wise to give your PIN number to only a few close friends,
1,It's frequently recommended that you remind yourself of your successes by using affirmations.,
0,it's normally fairly easy to get information about a competitor by directly asking the company for it,
1,Items featured in store advertisements are not always on sale,
0,Iterative solutions are always better than recursive ones,
0,Jacob had the ability to interpret dreams,
1,Japan is the largest unevangelized nations that is completely open to missionaries.,
0,Japan's isolation and border enforcement has practically eliminated illegal immigration.,
1,Japan's population is beginning to shrink.,
1,"Jean-Paul Sartre's claim that ""existence precedes essence"" means that who we are is what nature made us to be.",
1,Jellyfish exhibit Bioluminescence,
0,Jesus gave the name of the 4th cup and called it the cup of consummation,
1,Jesus is scared and afraid in the garden of Gethsemane,
0,Jesus offers great resistance to the amazement of everyone,
0,Jesus takes the 4th cup at the end of the last supper,
0,Jesus' death was the sole result of Judas turning Jesus into the Sanhedrin,
1,Jesus' entire life was directed towards his passion,
0,John Searle's Chinese room argument attempted to refute physicalism.,
1,Joseph was a shepherd,
0,Journalizing a transaction with both the debit and the credit for $69 instead of $96 will cause the trial balance to be out of balance.,
1,Judah comes up with the idea to sell Joseph,
0,Judas was forced by the chief priests to hand Jesus over to them,
1,Jump cuts are a form of elliptical editing,
0,"Just as with a Chapter 7 bankruptcy, the debt of a Chapter 13 bankrupt are discharged.",
1,Karl Marx believed that the ideas of the Utopian Socialists were unsystematic and unscientific.,
1,Kenya has one of the highest population growth rates in the world.,
1,Kenya has one of the world's highest Evangelical populations.,
0,Kenya is nearly half Muslim.,
0,Kenya's Evangelical population has declined slightly in the past 10 years.,
0,Kepler's first law is about planets orbiting a host star in the shape of an ellipse with the host star at the center of the ellipse,
1,"Kepler's second law is about the speed of planets, where planets move faster at perihelion and slower at aphelion",
1,"Key factors that influence the rate of chemical reactions include, concentration, surface area, temperature, and catalysts",
1,"Kickbacks and payoffs may be acceptable practices to the vice president of sales and marketing, yet may be viewed as unethical by members of the sales force, the board of directors, investors, and the general public.",
1,Kinetic energy can be transformed into potential energy.,
0,Kitchen forks are used for eating salads and vegetables,
1,Knowledge of elasticity is especially valuable to producers because it indicates the effect a price change will have on how much comsumers spend on this product.,
1,L-glucose is not transported by GLUT-1; its affinity is more than 1000times less than of the D-form,
1,Lake deposits tend to form effusive eruptions,
1,Large layers of cross-bedded sand can be indicative of a desert environment,
1,"Laura is considering the possibility of becoming a surety to Carl on a debt by David, but she would like more information on the relationship between Carl and David concerning the transaction. If Laura requests such information from Carl, he must disclose it, because his failure to disclose material facts will constitute fraud.",
0,Leisure is unaffected by social class,
0,Leonardo da Vinci founded a school in pisa of iatro-mathematics and iatro-physics,
0,Lesbian and gay couples tend to be more constrained by social and institutional gender roles and heterosexual families,
1,Less than 20% of American teachers are from minority groups.,
1,Less than half of Chile's Evangelicals attend church regularly.,
1,"Let us consider an uncharged substance, such as glucose.equilibrium can occur only when glucose concentration is equal on the two sides of a membrane",
0,Letters from satisfied customers are ineffective sales tools.,
0,"Leucoplasts contain yellow, orange, and red pigments",
1,Levels of kidnapping and assassination are abnormally high in Colombia.,
1,Life expectancy is a critical factor in determining the amount of money that will be needed in retirement,
1,Life in Mexico is powerfully influenced by the United States.,
1,Light can behave as a particle and a wave,
0,"Like other western nations, Australia's population is shrinking.",
0,"Like other Western nations, New Zealand's population is shrinking.",
1,Likes dissolve likes,
0,Literacy rates are unrelated to fertility rate.,
1,Living organisms couple exergonic and endergonic reactions together,
0,Living organisms do not undergo an increase in internal disorder when they metabolize their nutrients due to the decrease in the entropy of the surroundings,
1,Loans can be a feature of 401k plans,
0,Logic is the study of the psychological causes of our beliefs.,
0,Logically necessary truths are examples of a posteriori knowledge.,
0,Lorenzo is very well respected in his community and people have encouraged him to act as a leader to try to challenge discrimination in their community and social movements collar would identify Raymond as a cultural resource,
1,Lot accompanies Abrams and Sarai when they move to Canaan,
0,Louis XIV built Versailles to allow for better communications with his people.,
0,loyalty is a rational motive,
1,Machiavelli's The Prince attempted to find ways to unify the entire Italian peninsula under a powerful ruler.,
0,macroeconomics studies how individuals make decisions about what to produce and what to consume,
1,"Magma tends to move upward, away from where it formed",
1,Mainstream narrative films don't typically display the repetition if an event.,
1,Mala prohibida offenses are the acts that are said to be wrong only because they are prohibited.,
0,Malchus is the high priest that had his ear cut off by James,
0,Manic love is a peaceful and tranquil love.,
0,manufacturers are responsible for most final pricing decisions,
1,Many adolescents who have weight problems continue to have weight problems as adults,
0,"Many business organizations, professional associations and certification agencies have established written codes of ethics.",
0,many businesses reduce marketing efforts when faced with financial problems,
1,Many classical Greek astronomers believed Earth could not move because they detected no parallax,
1,many compounded interest calculators are available on the Internet,
1,many salespeople are not paid unless they sell something,
1,Many young people on their first job make the mistake of trying to buy too many luxury items,
0,Marine magnetic anomalies lay roughly perpendicular to mid-ocean ridges,
1,Market competition promotes bpth productive efficiency and allocative efficiency,
0,Market economics focuses on the perform of the economy as a whole.,
1,market segments play a significant role in determining competition strategies,
1,marketers try to encourage brand loyalty,
1,marketing can help a business solve problems,
1,marketing intelligence is the process of gaining information about the competition,
0,marketing is more effective when it is not integrated into other business activities,
1,marketing strategies are developed as a part of the business plans,
1,marketing strategies are developed as part of the business plans,
0,marketing today is very similar to marketing 20 years ago,
0,Mass flux is an intensive property like concentration or temperature,
0,Mass murderers are more difficult to apprehend than serial killers.,
0,Material Incentives are most likely to outweigh the risks and cost of participation in a social movement,
0,Matthias Schleiden studied animal cells,
0,Maximum cliff vesting in a DB plan is 10 years,
0,Maxwells Demon can observe accurately the type and the distribution of the molecules in his room,
0,Mayrr analysed blood flow by using the principles of physics,
0,Mdicare covers all doctor's fees 100%,
0,Meal managers should plan on spending the same amount of money to feed each member of the family,
1,"measures mark off groupings of beats, each with a fixed number that coincides with the meter",
0,Meats are an excellent source of carbs,
1,Media convergence has occurred because nearly every media vehicle has one more websites,
1,Medical sociology addresses a wide variety of specific issues such as racial ethnic differences in health care,
0,Medicare benefits are only available to people collecting social security,
1,Medicare part A covers the cost of hospital related expenses,
1,Medicare Part D requires a monthly premium,
1,Medicare payroll taxes have an unlimited ceiling on earnings,
0,meeting your physiological needs is optional,
1,Meijer is private cooperation.,
0,Meiosis would be used in asexual reproduction.,
1,"melodies that move principally by small, connected intervals are conjunct",
1,melodies that skip in disjointed intervals are disjunct,
0,melody and harmony function independently of each other,
0,Merchandise inventory account is found is found on the income statement,
1,Metabolic syndrome by based on real physical markers is also a social construct that fails to consider social and environmental factors,
1,Metallic is a term used to describe a type of luster,
0,Metaphysical materialism is a form of dualism.,
1,meter is an organizing principle shared by music and poetry,
1,Mexico City is one of the largest urban conglomerations in the world.,
1,Mexico is the world's largest Spanish-speaking country.,
0,Mexico ships drugs to the U.S. but its own drug problem is quite small by comparison.,
1,Mexico's Evangelical christians have a strong missionary vision.,
0,Mexico's Evangelicals are largely rural.,
0,Mexico's governmental policies have produced a high level of income equality.,
0,Mexico's per capita income is similar to Haiti's.,
1,Michael is a college graduate who enjoys sports and Italian food. He is married to Jennifer who is also a college graduate and enjoys playing sports and going out to Italian restaurants. Michael and Jennifer's relationship is endogamous,
1,Michelle is from a high income family and all her relatives have advanced degrees Michelle is likely to have a college going habits,
0,Microeconomics focuses on the overall performance of the economy.,
1,Millions in Mexico depends on money made in the United States.,
0,Mise-en-scene is a term that borrows from literature,
1,Mitochondria and chloroplasts are more similar than mitochondria and another organelle,
0,Mobility is measured in Nm/s,
1,Mobility of uncharged particles can be defined as the velocity of a molecule per unit driving force,
1,Modeling theory emphasizes the need to learn aggressive behavior.,
0,"Modern biophysics has made profound contributions to subjects normally considered a part of classical biology, such as evolution and immunity",
1,Modern inner-city gangs are often heavily involved with drug dealing.,
0,Molar mass is the number of moles of a substance that would have a mass of 1 gram,
1,Molecular biology is a largely descriptive science,
0,Molecules that have oxygen are considered organic,
1,money market accounts usually pay higher interest rates than regular savings accounts,
0,Monochronemic societies tend to schedule many different tasks at one time.,
1,More people die of communicable diseases in the least developed countries of the world than in the developed countries.,
1,More than 80% of googles annual revenue in 2014 came from advertising,
1,More than four-fifths of the states have adopted a common core of academic standards in mathematics and language arts.,
1,More than one fourth of Nigerians are evangelical Christians.,
1,More women than men attend church.,
0,Most bacteria are pathogens,
1,Most biological aspects of maleness and femaleness exist on a continuum,
0,Most children receiving special education services do so in separate classrooms with special education teachers.,
0,most compositions have one type of texture exclusively,
1,Most conflicts contain elements of disagreement about content and relationship,
0,most consumers are individuals who make decisions in a unique way,
1,Most convenience foods cost more than homemade ones,
1,Most corporate define benefit plans provide for benefits guaranteed by the PBCG,
0,Most films privilege asynchronous sound over synchronous sound,
0,Most hate crimes are committed by organized hate groups and their members.,
1,Most Koreans who have emigrated elsewhere are Christians.,
1,Most large musical ensembles need a conductor in order to perform together,
1,Most lipid synthesis occurs on the cytosolic leaflet of the smooth ER,
1,Most mainstream Hollywood films tend to show and event only happening once,
0,most marketing intelligence techniques are illegal or unethical,
1,Most medicines attach to binding proteins,
1,Most new microwave ovens produce a maximum wattage of 600-1100 watts,
0,Most of the people of Japan are Japanese but there is a sizable Chinese minority.,
1,Most of the Protestant population in Chad is Evangelical.,
1,Most of the world's people live in moderately developed countries.,
0,Most organelles have their own DNA,
1,most people begin their career by accepting an entry-level job within a company,
0,most people can pay for a home without borrowing,
0,Most preschool children tend to like spicy foods with crunchy textures,
0,Most Roman Catholics in Mexico are quite devout.,
0,Most scales used for measuring psychological variables are either ratio or interval,
0,Most school superintendents and principals claim that the quality of new teachers has declined.,
1,most service businesses do not use a channel of distribution,
0,"Most soleproprietorships have many employee's, creating managment difficulties.",
1,Most thermodynamic equations are functions with several variables,
0,Most Vietnamese are still committed to the Communist revolution.,
0,Most young people do not qualify to use the simplest of the tax forms -- 1040EZ,
0,Mothers are more likely than fathers to abuse their children,
1,Movement of molecules through channels is faster in comparison with the rates achieved by transporters,
1,Multiple regression uses more than one predictor variable,
1,musical structure generally features a balance between unity and variety,
0,Muslim Sharia law tends to eliminate government corruption.,
0,Muslims and Christians have settled into peaceful coexistence,
1,Mutliway selection chooses among several alternatives,
1,Myanmar is governed by an oppressive military regime.,
0,Myanmar is over 95% Buddhist.,
0,Myanmar's government has killed almost all its Buddhist monks.,
0,NaCI is a molecular,
1,NAFTA required that tariffs on most goods produced and sold in North America be gradually eliminated by the year 2009,
1,"Needs are the things you cannot live without, and wants are the things you would like to have but can live without",
0,"Negotiable instruments payable ""to bearer"" are considered the safest form.",
0,Nepal is less than 1% Evangelical.,
1,Nepal is one of the poorest countries in the world.,
0,Nepal is predominately Muslim.,
1,Nernst equation describes the condition when an ion is in equilibrium across a membrane,
1,Net income is the amount you receive after withholdings are subtracted from your gross pay,
1,Neuroplasticity refers to the brain's ability to change its structure and function in response to injury or experience.,
0,Neutrality is a supportive conflict management strategy,
0,"New technology increases the need for more workers to produce a given amount of output, thereby lowering the unemployment rate.",
